{
  "schemaVersion": "notice-source-manifest-v1",
  "manifestVersion": "2026-07-26.1",
  "universitySlug": "cau",
  "sources": [
    {
      "sourceId": "cau_001",
      "universitySlug": "cau",
      "universityId": "9",
      "collegeId": "136",
      "departmentId": "910",
      "orgUnitId": "719",
      "collegeName": "경영경제대학",
      "departmentName": "경영학부",
      "sourceLevel": "department",
      "sourceName": "중앙대 경영학부",
      "listUrl": "https://biz.cau.ac.kr/2016/sub06/sub06_01_list.php",
      "baseUrl": "https://biz.cau.ac.kr",
      "listItemSelector": "",
      "linkSelector": "a[href]",
      "titleSelector": "",
      "dateSelector": "",
      "detailContentSelector": "",
      "detailDateSelector": "",
      "noticeUrlPattern": "",
      "keywords": [
        "장학",
        "장학금",
        "학자금",
        "등록금",
        "scholarship",
        "tuition",
        "fellowship"
      ],
      "adapter": "",
      "enabled": true
    },
    {
      "sourceId": "cau_002",
      "universitySlug": "cau",
      "universityId": "9",
      "collegeId": "136",
      "departmentId": "509",
      "orgUnitId": "720",
      "collegeName": "경영경제대학",
      "departmentName": "경제학부",
      "sourceLevel": "department",
      "sourceName": "중앙대 경제학부",
      "listUrl": "https://econ.cau.ac.kr/news/notice/",
      "baseUrl": "https://econ.cau.ac.kr",
      "listItemSelector": "",
      "linkSelector": "a[href]",
      "titleSelector": "",
      "dateSelector": "",
      "detailContentSelector": "",
      "detailDateSelector": "",
      "noticeUrlPattern": "",
      "keywords": [
        "장학",
        "장학금",
        "학자금",
        "등록금",
        "scholarship",
        "tuition",
        "fellowship"
      ],
      "adapter": "",
      "enabled": true
    },
    {
      "sourceId": "cau_003",
      "universitySlug": "cau",
      "universityId": "9",
      "collegeId": "136",
      "departmentId": "511",
      "orgUnitId": "721",
      "collegeName": "경영경제대학",
      "departmentName": "광고홍보학과",
      "sourceLevel": "department",
      "sourceName": "중앙대 광고홍보학과",
      "listUrl": "https://iadpr.cau.ac.kr/fm/fm_1.php",
      "baseUrl": "https://iadpr.cau.ac.kr",
      "listItemSelector": "",
      "linkSelector": "a[href]",
      "titleSelector": "",
      "dateSelector": "",
      "detailContentSelector": "",
      "detailDateSelector": "",
      "noticeUrlPattern": "",
      "keywords": [
        "장학",
        "장학금",
        "학자금",
        "등록금",
        "scholarship",
        "tuition",
        "fellowship"
      ],
      "adapter": "",
      "enabled": true
    },
    {
      "sourceId": "cau_004",
      "universitySlug": "cau",
      "universityId": "9",
      "collegeId": "136",
      "departmentId": "512",
      "orgUnitId": "722",
      "collegeName": "경영경제대학",
      "departmentName": "국제물류학과",
      "sourceLevel": "department",
      "sourceName": "중앙대 국제물류학과",
      "listUrl": "https://log.cau.ac.kr/dm/dm_1.php",
      "baseUrl": "https://log.cau.ac.kr",
      "listItemSelector": "",
      "linkSelector": "a[href]",
      "titleSelector": "",
      "dateSelector": "",
      "detailContentSelector": "",
      "detailDateSelector": "",
      "noticeUrlPattern": "",
      "keywords": [
        "장학",
        "장학금",
        "학자금",
        "등록금",
        "scholarship",
        "tuition",
        "fellowship"
      ],
      "adapter": "",
      "enabled": true
    },
    {
      "sourceId": "cau_006",
      "universitySlug": "cau",
      "universityId": "9",
      "collegeId": "136",
      "departmentId": "513",
      "orgUnitId": "724",
      "collegeName": "경영경제대학",
      "departmentName": "산업보안학과",
      "sourceLevel": "department",
      "sourceName": "중앙대 산업보안학과",
      "listUrl": "https://security.cau.ac.kr/board.htm?bbsid=notice",
      "baseUrl": "https://security.cau.ac.kr",
      "listItemSelector": "",
      "linkSelector": "a[href]",
      "titleSelector": "",
      "dateSelector": "",
      "detailContentSelector": "",
      "detailDateSelector": "",
      "noticeUrlPattern": "",
      "keywords": [
        "장학",
        "장학금",
        "학자금",
        "등록금",
        "scholarship",
        "tuition",
        "fellowship"
      ],
      "adapter": "",
      "enabled": true
    },
    {
      "sourceId": "cau_007",
      "universitySlug": "cau",
      "universityId": "9",
      "collegeId": "136",
      "departmentId": "510",
      "orgUnitId": "725",
      "collegeName": "경영경제대학",
      "departmentName": "응용통계학과",
      "sourceLevel": "department",
      "sourceName": "중앙대 응용통계학과",
      "listUrl": "https://stat.cau.ac.kr/notice/undergraduate",
      "baseUrl": "https://stat.cau.ac.kr",
      "listItemSelector": "",
      "linkSelector": "a[href]",
      "titleSelector": "",
      "dateSelector": "",
      "detailContentSelector": "",
      "detailDateSelector": "",
      "noticeUrlPattern": "",
      "keywords": [
        "장학",
        "장학금",
        "학자금",
        "등록금",
        "scholarship",
        "tuition",
        "fellowship"
      ],
      "adapter": "",
      "enabled": true
    },
    {
      "sourceId": "cau_008",
      "universitySlug": "cau",
      "universityId": "9",
      "collegeId": "136",
      "departmentId": "514",
      "orgUnitId": "726",
      "collegeName": "경영경제대학",
      "departmentName": "지식경영학부",
      "sourceLevel": "department",
      "sourceName": "중앙대 지식경영학부",
      "listUrl": "https://global.cau.ac.kr/kr/notice/notice.php",
      "baseUrl": "https://global.cau.ac.kr",
      "listItemSelector": "",
      "linkSelector": "a[href]",
      "titleSelector": "",
      "dateSelector": "",
      "detailContentSelector": "",
      "detailDateSelector": "",
      "noticeUrlPattern": "",
      "keywords": [
        "장학",
        "장학금",
        "학자금",
        "등록금",
        "scholarship",
        "tuition",
        "fellowship"
      ],
      "adapter": "",
      "enabled": true
    },
    {
      "sourceId": "cau_009",
      "universitySlug": "cau",
      "universityId": "9",
      "collegeId": "138",
      "departmentId": "519",
      "orgUnitId": "731",
      "collegeName": "공과대학",
      "departmentName": "건설환경플랜트공학전공",
      "sourceLevel": "department",
      "sourceName": "중앙대 건설환경플랜트공학전공",
      "listUrl": "https://civil.cau.ac.kr/?version=135&spkey=5b3a3e4874f80210e3b655253439c7e702c29894&module=true&PageAccess=main/board&brcode=notice01",
      "baseUrl": "https://civil.cau.ac.kr",
      "listItemSelector": "",
      "linkSelector": "a[href]",
      "titleSelector": "",
      "dateSelector": "",
      "detailContentSelector": "",
      "detailDateSelector": "",
      "noticeUrlPattern": "",
      "keywords": [
        "장학",
        "장학금",
        "학자금",
        "등록금",
        "scholarship",
        "tuition",
        "fellowship"
      ],
      "adapter": "",
      "enabled": true
    },
    {
      "sourceId": "cau_010",
      "universitySlug": "cau",
      "universityId": "9",
      "collegeId": "138",
      "departmentId": "911",
      "orgUnitId": "732",
      "collegeName": "공과대학",
      "departmentName": "건축학부",
      "sourceLevel": "department",
      "sourceName": "중앙대 건축학부",
      "listUrl": "http://archicau.com/wordpress/%ea%b3%b5%ec%a7%80%ec%82%ac%ed%95%ad/",
      "baseUrl": "http://archicau.com",
      "listItemSelector": "",
      "linkSelector": "a[href]",
      "titleSelector": "",
      "dateSelector": "",
      "detailContentSelector": "",
      "detailDateSelector": "",
      "noticeUrlPattern": "",
      "keywords": [
        "장학",
        "장학금",
        "학자금",
        "등록금",
        "scholarship",
        "tuition",
        "fellowship"
      ],
      "adapter": "",
      "enabled": true
    },
    {
      "sourceId": "cau_011",
      "universitySlug": "cau",
      "universityId": "9",
      "collegeId": "138",
      "departmentId": "524",
      "orgUnitId": "733",
      "collegeName": "공과대학",
      "departmentName": "기계공학부",
      "sourceLevel": "department",
      "sourceName": "중앙대 기계공학부",
      "listUrl": "https://me.cau.ac.kr/bbs/board.php?bo_table=sub5_1",
      "baseUrl": "https://me.cau.ac.kr",
      "listItemSelector": "",
      "linkSelector": "a[href]",
      "titleSelector": "",
      "dateSelector": "",
      "detailContentSelector": "",
      "detailDateSelector": "",
      "noticeUrlPattern": "",
      "keywords": [
        "장학",
        "장학금",
        "학자금",
        "등록금",
        "scholarship",
        "tuition",
        "fellowship"
      ],
      "adapter": "",
      "enabled": true
    },
    {
      "sourceId": "cau_013",
      "universitySlug": "cau",
      "universityId": "9",
      "collegeId": "138",
      "departmentId": "912",
      "orgUnitId": "736",
      "collegeName": "공과대학",
      "departmentName": "에너지시스템공학부",
      "sourceLevel": "department",
      "sourceName": "중앙대 에너지시스템공학부",
      "listUrl": "http://cauese.co.kr/%EC%BB%A4%EB%AE%A4%EB%8B%88%ED%8B%B0/?term=4",
      "baseUrl": "http://cauese.co.kr",
      "listItemSelector": "",
      "linkSelector": "a[href]",
      "titleSelector": "",
      "dateSelector": "",
      "detailContentSelector": "",
      "detailDateSelector": "",
      "noticeUrlPattern": "",
      "keywords": [
        "장학",
        "장학금",
        "학자금",
        "등록금",
        "scholarship",
        "tuition",
        "fellowship"
      ],
      "adapter": "",
      "enabled": true
    },
    {
      "sourceId": "cau_016",
      "universitySlug": "cau",
      "universityId": "9",
      "collegeId": "138",
      "departmentId": "528",
      "orgUnitId": "738",
      "collegeName": "공과대학",
      "departmentName": "첨단소재공학과",
      "sourceLevel": "department",
      "sourceName": "중앙대 첨단소재공학과",
      "listUrl": "http://ame.cau.ac.kr/bbs/board.php?tbl=bbs49",
      "baseUrl": "http://ame.cau.ac.kr",
      "listItemSelector": "",
      "linkSelector": "a[href]",
      "titleSelector": "",
      "dateSelector": "",
      "detailContentSelector": "",
      "detailDateSelector": "",
      "noticeUrlPattern": "",